{
  "schema_version": "1.0",
  "generated_at": "2026-07-13T16:15:00Z",
  "run_id": "fixture-001",
  "data": [
    { "symbol": "RELIANCE", "name": "Reliance Industries Ltd.", "exchange": "NSE", "isin": "INE002A01018", "sector": "Oil & Gas", "industry": "Refineries", "mcap_cr": 1850000, "mcap_category": "Large Cap", "listing_date": "1977-11-29", "is_active": true },
    { "symbol": "TCS", "name": "Tata Consultancy Services Ltd.", "exchange": "NSE", "isin": "INE467B01029", "sector": "Information Technology", "industry": "IT - Software", "mcap_cr": 1520000, "mcap_category": "Large Cap", "listing_date": "2004-08-25", "is_active": true },
    { "symbol": "HDFCBANK", "name": "HDFC Bank Ltd.", "exchange": "NSE", "isin": "INE040A01034", "sector": "Financial Services", "industry": "Banks - Private", "mcap_cr": 1380000, "mcap_category": "Large Cap", "listing_date": "1995-11-08", "is_active": true },
    { "symbol": "INFY", "name": "Infosys Ltd.", "exchange": "NSE", "isin": "INE009A01021", "sector": "Information Technology", "industry": "IT - Software", "mcap_cr": 680000, "mcap_category": "Large Cap", "listing_date": "1993-02-08", "is_active": true },
    { "symbol": "TATAMOTORS", "name": "Tata Motors Ltd.", "exchange": "NSE", "isin": "INE155A01022", "sector": "Automobile", "industry": "Auto - Cars & Jeeps", "mcap_cr": 295000, "mcap_category": "Large Cap", "listing_date": "1998-07-22", "is_active": true }
  ]
}
